,id,questions
135,3aa6a195-4a56-4622-83d9-2e0d5e064cc4,Is there an easy 5-minute mocha pots recipe (under 10 minutes) that uses coffee-flavored chocolate and a dollop of crème fraîche?
135,3aa6a195-4a56-4622-83d9-2e0d5e064cc4,How do I make creamy mocha pots with 300ml double cream and 200g milk or dark chocolate with coffee—can I use milk chocolate for kids?
135,3aa6a195-4a56-4622-83d9-2e0d5e064cc4,Quick dessert: what are the ingredients and total time for the 5-star rated mocha pots?
135,3aa6a195-4a56-4622-83d9-2e0d5e064cc4,"Simple, no-fuss mocha pots with crème fraîche and vanilla extract—is this recipe good for beginner cooks?"
135,3aa6a195-4a56-4622-83d9-2e0d5e064cc4,"Can I make rich mocha pots in about 7 minutes using double cream and vanilla extract, and what makes them so creamy?"
136,27300dfa-91f3-4ad4-b4d8-4bb385677df7,How do I make an easy white chocolate rocky road with dried cherries and mini marshmallows in about 15 minutes?
136,27300dfa-91f3-4ad4-b4d8-4bb385677df7,"Quick no-bake 'white forest' rocky road recipe with biscuits, almonds and desiccated coconut — what ingredients and yield do I need?"
136,27300dfa-91f3-4ad4-b4d8-4bb385677df7,"Can I use dried cherries instead of glacé cherries in a white chocolate rocky road, and will it affect texture?"
136,27300dfa-91f3-4ad4-b4d8-4bb385677df7,Is there a vegetarian version of this white chocolate rocky road that uses vegetarian mini marshmallows?
136,27300dfa-91f3-4ad4-b4d8-4bb385677df7,Party-sized white chocolate rocky road: how many servings will a batch made with 500g white chocolate and 100g butter give?
137,695d3e96-5da3-4964-9699-1eb45c25dd5f,Easy no-bake Bakewell trifles with amaretti biscuits and cherry compote — ready in 15 minutes?
137,695d3e96-5da3-4964-9699-1eb45c25dd5f,"Quick Bakewell trifle recipe using madeira loaf cake, maraschino cherries and custard?"
137,695d3e96-5da3-4964-9699-1eb45c25dd5f,How do I make individual cherry-and-almond trifles topped with toasted flaked almonds and crunchy amaretti?
137,695d3e96-5da3-4964-9699-1eb45c25dd5f,5-star quick dessert: Bakewell trifles with double cream and jarred cherry compote — what ingredients do I need?
137,695d3e96-5da3-4964-9699-1eb45c25dd5f,Can I impress guests with a simple Bakewell trifle using amaretti biscuits and store-bought custard (no cooking)?
138,a366dea9-724e-4287-815d-be8a24b55dbc,How do I make a quick vegan microwave mug cake with lemon and raspberries in under 10 minutes?
138,a366dea9-724e-4287-815d-be8a24b55dbc,Single-serve vegan mug cake using oat milk and sunflower oil — any easy recipe suggestions?
138,a366dea9-724e-4287-815d-be8a24b55dbc,Quick dessert: vegan mug cake for one that's ready in about 7 minutes — what ingredients do I need?
138,a366dea9-724e-4287-815d-be8a24b55dbc,How can I make a light lemon-flavored vegan mug cake with fresh or frozen raspberries?
138,a366dea9-724e-4287-815d-be8a24b55dbc,"Simple, easy vegan mug cake (4-star rating) — tips to keep it moist without dairy?"
139,e17e0c7f-43c1-4ed6-a95a-a3fb3bbfa71c,How do I make a silky chocolate ganache with extra virgin olive oil and sea salt served with crisp ciabatta toasts?
139,e17e0c7f-43c1-4ed6-a95a-a3fb3bbfa71c,Quick 20-minute dinner party dessert using 70% dark chocolate and cream with toasts — any simple recipes?
139,e17e0c7f-43c1-4ed6-a95a-a3fb3bbfa71c,Easy chocolate ganache with an olive oil drizzle and flaky sea salt — is this good for entertaining and how simple is it?
139,e17e0c7f-43c1-4ed6-a95a-a3fb3bbfa71c,Can I make a small batch ganache with 250ml double cream and 250g 70% dark chocolate to serve with sliced ciabatta?
139,e17e0c7f-43c1-4ed6-a95a-a3fb3bbfa71c,Top-rated (5-star) quick dessert: chocolate ganache with ciabatta toasts and sea salt — any serving or presentation tips?
140,aae40b12-b592-4010-9ad9-451b78300c01,"How do I make a quick, easy strawberry mousse with mascarpone and a gingernut biscuit crunch in about 25 minutes?"
140,aae40b12-b592-4010-9ad9-451b78300c01,Is there a cheat's strawberry mousse recipe with a tangy strawberry compote and chopped pistachios on top?
140,aae40b12-b592-4010-9ad9-451b78300c01,Can I make a no-bake strawberry dessert using double cream and vanilla bean paste that's ready in under half an hour?
140,aae40b12-b592-4010-9ad9-451b78300c01,Simple quick dessert: strawberry mascarpone mousse with a ginger biscuit base — is this suitable for beginners?
140,aae40b12-b592-4010-9ad9-451b78300c01,Looking for a 4-star quick strawberry mousse that optionally uses crushed freeze-dried strawberries and crushed gingernuts — any recipe?
141,a7542de1-ace1-4b9b-8f7c-c1af26c8dd0b,Easy no-cook vanilla and apple dessert with ginger biscuits — is there a 10-minute fool recipe?
141,a7542de1-ace1-4b9b-8f7c-c1af26c8dd0b,"Quick 4-ingredient vanilla yogurt, apple sauce and ginger biscuit fool for serving guests?"
141,a7542de1-ace1-4b9b-8f7c-c1af26c8dd0b,How do I make a simple dessert using vanilla-flavoured yogurt and crushed ginger biscuits?
141,a7542de1-ace1-4b9b-8f7c-c1af26c8dd0b,No-bake fool with chunky apple sauce and double cream that’s ready in 10 minutes — recipe?
141,a7542de1-ace1-4b9b-8f7c-c1af26c8dd0b,"Vanilla, apple & ginger biscuit fool (easy, rating 3) — is this worth trying for a quick dessert?"
142,145adc33-cae6-495d-b1c4-d5905678979a,How can I make an easy raspberry fool with whisky and toasted oats in about 20 minutes?
142,145adc33-cae6-495d-b1c4-d5905678979a,"Quick summer dessert recipe using raspberries, double cream and a splash of whisky?"
142,145adc33-cae6-495d-b1c4-d5905678979a,5-star raspberry fool with toasted oats and grated white chocolate — is there a simple recipe?
142,145adc33-cae6-495d-b1c4-d5905678979a,"Looking for a no-bake, easy quick dessert that uses demerara sugar, whisky and raspberries — any ideas?"
142,145adc33-cae6-495d-b1c4-d5905678979a,Can I make a raspberry and white chocolate fool with toasted oats for a last-minute dessert (20 min)?
143,c5b8b225-3bea-4cec-9afa-bef00ef311b4,Easy apple crumble sundae with Granny Smith apples and crushed ginger nut biscuits — can I make this in about 20 minutes?
143,c5b8b225-3bea-4cec-9afa-bef00ef311b4,How many does an apple crumble sundae with 8 scoops of vanilla ice cream serve?
143,c5b8b225-3bea-4cec-9afa-bef00ef311b4,"Quick budget sundae idea using diced tart apples, cinnamon and light brown sugar — is this good for a midweek dessert?"
143,c5b8b225-3bea-4cec-9afa-bef00ef311b4,"What ingredients do I need for the simple apple crumble sundae (butter, brown sugar, cinnamon, vanilla ice cream, ginger nuts)?"
143,c5b8b225-3bea-4cec-9afa-bef00ef311b4,This apple crumble sundae has a 4-star rating — does the ginger nut crumb and tart Granny Smith apple combo make it more crunchy or tangy?
144,84ef2744-310f-481e-8c58-13150a5133e5,Quick lemon curd and yogurt fool using 0% Greek yogurt and fresh raspberries — can I make this in 5 minutes?
144,84ef2744-310f-481e-8c58-13150a5133e5,"Easy family dessert with lemon curd, raspberries and shortbread to serve — recipe around 300 kcal per portion?"
144,84ef2744-310f-481e-8c58-13150a5133e5,How can I make a lemon curd fool that's higher in protein (about 16g) using Greek yogurt?
144,84ef2744-310f-481e-8c58-13150a5133e5,"Simple, highly rated (5-star) lemon curd & yogurt fool — is there a no-cook version with store-bought lemon curd?"
144,84ef2744-310f-481e-8c58-13150a5133e5,Light lemon curd and raspberry fool for guests — can I sweeten with icing sugar and serve with shortbread?
145,21c5beab-3da4-4d2d-8c0c-8eaf99c50f30,"Quick banoffee splits recipe with bananas, 4 scoops of ice cream and a chopped chocolate bar — ready in 10 minutes?"
145,21c5beab-3da4-4d2d-8c0c-8eaf99c50f30,Easy banoffee dessert that uses cream and butter to make a creamy chocolate sauce — how do I make it?
145,21c5beab-3da4-4d2d-8c0c-8eaf99c50f30,"Simple, beginner-friendly banoffee splits (quick desserts) featuring a silky chocolate sauce — is there an easy recipe?"
145,21c5beab-3da4-4d2d-8c0c-8eaf99c50f30,What are the nutrition details for this banoffee splits — is it about 519 kcal and high in saturated fat?
145,21c5beab-3da4-4d2d-8c0c-8eaf99c50f30,Can I make banoffee splits for two using 2 small ripe bananas and 4 scoops of ice cream?
146,20b99ff7-e136-4ac2-87f8-da3342591490,Easy no-cook after-dinner mint cream with mascarpone and cream sherry — can I make this in 10 minutes?
146,20b99ff7-e136-4ac2-87f8-da3342591490,Quick mint choc chip-style syllabub using thin after-dinner mints and leftover chocolates — where's the recipe?
146,20b99ff7-e136-4ac2-87f8-da3342591490,Simple creamy dessert made with mascarpone and double cream (no baking) — is there a beginner-friendly version?
146,20b99ff7-e136-4ac2-87f8-da3342591490,How indulgent is this after-dinner mint cream? It lists about 595 kcal — is that per serving?
146,20b99ff7-e136-4ac2-87f8-da3342591490,"Looking for a 4-star, 10-minute mint dessert for guests — a mint cream/syllabub recipe that uses after-dinner mints?"
147,b51392db-5984-4f37-aca6-dfa2f191a17b,Quick Baileys banana trifle recipe with brownies and toffee sauce — easy make-ahead dessert for grown-ups?
147,b51392db-5984-4f37-aca6-dfa2f191a17b,How can I make a 10-minute no-bake banana trifle using Irish cream and vanilla custard?
147,b51392db-5984-4f37-aca6-dfa2f191a17b,Easy Baileys banana trifles using crumbled chocolate brownies — can I prepare them ahead for a dinner party?
147,b51392db-5984-4f37-aca6-dfa2f191a17b,What's a kid-friendly version of Baileys banana trifles if I want to skip the Irish cream and use extra toffee sauce?
147,b51392db-5984-4f37-aca6-dfa2f191a17b,Nutritional info: is a Baileys banana trifle made with double cream and toffee around 689 kcal per serving?
148,ffb1d9e6-8327-4fc7-b4cc-ba74b4e8bd9d,No-bake chocolate tart with a biscuit base and mixed dark + milk chocolate — can I make this in 25 minutes?
148,ffb1d9e6-8327-4fc7-b4cc-ba74b4e8bd9d,How do I make a rich no-bake chocolate tart that uses golden syrup (or honey) and is decorated with crème fraîche?
148,ffb1d9e6-8327-4fc7-b4cc-ba74b4e8bd9d,"Looking for a more-effort, 5-star no-bake chocolate tart recipe that's make-ahead (up to two days) — any tips?"
148,ffb1d9e6-8327-4fc7-b4cc-ba74b4e8bd9d,No-bake chocolate tart around 487 kcal per serving with a creamy filling and crunchy biscuit crust — recipe?
148,ffb1d9e6-8327-4fc7-b4cc-ba74b4e8bd9d,Can I get a no-bake chocolate tart that uses fresh raspberries and icing sugar for serving and keeps well as leftovers?
149,0b4089b0-c144-4d38-a72a-d2e3c4382b14,Where can I find Gregg Wallace’s tangy lemon tart recipe that uses double cream and 5 eggs and takes about 85 minutes total?
149,0b4089b0-c144-4d38-a72a-d2e3c4382b14,Is Gregg’s tangy lemon tart (inspired by Michel Roux Snr) suitable for an experienced home baker? It’s listed as 'more effort' — any tips?
149,0b4089b0-c144-4d38-a72a-d2e3c4382b14,How sharp/tangy is Gregg’s lemon tart — it calls for juice of 2–3 lemons and 2 tbsp zest — will that be very tart?
149,0b4089b0-c144-4d38-a72a-d2e3c4382b14,What’s the nutrition on Gregg’s lemon tart? I see about 770 kcal and 44g fat listed — is that per portion?
149,0b4089b0-c144-4d38-a72a-d2e3c4382b14,Can I make Gregg Wallace’s lemon tart ahead of time given the 25 min prep and 60 min cooking — and how many servings does it make?
150,b11a27ab-8067-43ff-ab96-26dcfc958daf,Easy Raspberry Bakewell slice using sweet shortcrust pastry and apricot jam — is this recipe freezer-friendly?
150,b11a27ab-8067-43ff-ab96-26dcfc958daf,How long does it take to make a bakewell slice with thawed frozen raspberries and flaked almonds (about 80 minutes total)?
150,b11a27ab-8067-43ff-ab96-26dcfc958daf,Is this raspberry and almond slice suitable for beginner bakers? It mentions ground almonds and almond extract.
150,b11a27ab-8067-43ff-ab96-26dcfc958daf,Can I reduce the sugar or calories in this Raspberry Bakewell slice? The recipe shows about 595 kcal and 36g sugars.
150,b11a27ab-8067-43ff-ab96-26dcfc958daf,Best way to store or freeze bakewell slices made with sweet shortcrust pastry and raspberry/apricot jam?
151,9f6a63b0-a84d-4ed3-8d25-2024965745e7,Clementine custard tarts using a sheet of ready-rolled puff pastry and the juice of 6 clementines — how do I make this?
151,9f6a63b0-a84d-4ed3-8d25-2024965745e7,"Festive clementine custard tart recipe with clementine zest and juice for Christmas, total time about 50 minutes?"
151,9f6a63b0-a84d-4ed3-8d25-2024965745e7,Clementine custard tarts that use 2 eggs plus 3 yolks and 2 tbsp cornflour with whole milk — is this a difficult/more-effort recipe?
151,9f6a63b0-a84d-4ed3-8d25-2024965745e7,Recipe for clementine custard tarts where extra egg whites are frozen for meringues — good for serving with afternoon tea?
151,9f6a63b0-a84d-4ed3-8d25-2024965745e7,"5-star clementine custard tarts (prep 25 min, cook 25 min) — how many tarts does one sheet of ready-rolled puff pastry usually make?"
152,c71c9b57-715d-4b98-801b-34c11766b903,"How do I make a classic custard tart with a buttery pastry, lemon zest and a vanilla pod?"
152,c71c9b57-715d-4b98-801b-34c11766b903,Is the custard tart that uses 8 egg yolks and double cream worth the 105-minute total time?
152,c71c9b57-715d-4b98-801b-34c11766b903,More effort dessert: recipe and tips for a creamy custard tart with golden caster sugar and fresh nutmeg?
152,c71c9b57-715d-4b98-801b-34c11766b903,Nutritional info — a custard tart around 593 kcal per portion: full recipe and lighter substitutions?
152,c71c9b57-715d-4b98-801b-34c11766b903,What's the best way to make a crisp tart pastry using chilled butter and plain flour for a 4-star custard tart?
153,102ad8b8-c42d-4c86-8afb-580f0454a4f3,How do I make Raymond Blanc's tarte tatin with dark sticky caramel and all-butter puff pastry?
153,102ad8b8-c42d-4c86-8afb-580f0454a4f3,Tarte tatin using 6 dessert apples (about 900g) — what prep and cooking times should I expect?
153,102ad8b8-c42d-4c86-8afb-580f0454a4f3,This tarte tatin is rated 4 stars but listed as 'A challenge' — is it suitable for an experienced home baker?
153,102ad8b8-c42d-4c86-8afb-580f0454a4f3,"Which apple varieties (Braeburn, Cox’s Orange Pippin or Adam’s Pearmain) work best for a tarte tatin with crisp pastry?"
153,102ad8b8-c42d-4c86-8afb-580f0454a4f3,Serving suggestions for tarte tatin — is crème fraîche or full-fat vanilla ice cream recommended?
154,7ce62148-dbb3-409c-ba84-dc2220afae78,Easy flat apple & vanilla tart using a 375g pack of puff pastry and 5 apples — ready in about 30 minutes?
154,7ce62148-dbb3-409c-ba84-dc2220afae78,"Quick apple tart with apricot conserve glaze and vanilla sugar — are Cox's, russets or Elstar best for this recipe?"
154,7ce62148-dbb3-409c-ba84-dc2220afae78,Simple puff pastry apple tart for morning tea or dessert that’s rated 5 stars and easy for beginners?
154,7ce62148-dbb3-409c-ba84-dc2220afae78,Light 30-minute apple and vanilla tart made with all-butter puff pastry — about 356 kcal per serving?
154,7ce62148-dbb3-409c-ba84-dc2220afae78,How can I make a glossy flat apple tart with vanilla and apricot jam that looks impressive but is easy to prepare?
155,ecb37b2f-4a61-4e36-b9e8-2e1ed9539af8,"How do I make an easy Manchester tart with raspberry jam, toasted desiccated coconut and maraschino cherries?"
155,ecb37b2f-4a61-4e36-b9e8-2e1ed9539af8,Retro Manchester tart with custard filling and pastry base — can I make this in about 50 minutes?
155,ecb37b2f-4a61-4e36-b9e8-2e1ed9539af8,"Beginner-friendly Manchester tart that uses custard powder, vanilla bean paste and 5 egg yolks — what's the best method?"
155,ecb37b2f-4a61-4e36-b9e8-2e1ed9539af8,"Easy midweek Manchester tart (25 min prep, 50 min total) — is this a good, quick dessert for guests?"
155,ecb37b2f-4a61-4e36-b9e8-2e1ed9539af8,"Tips for a flaky Manchester tart pastry using 200g plain flour, 100g cold butter and icing sugar?"
156,bd5f202b-a407-4588-8195-e11193100a49,Easy mini Bakewell tarts using shop-bought shortcrust pastry and cherry jam — how long does this take to make?
156,bd5f202b-a407-4588-8195-e11193100a49,Simple frangipane mini tart recipe with ground almonds and glacé cherries — what ingredients and oven time do I need?
156,bd5f202b-a407-4588-8195-e11193100a49,Beginner-friendly Bakewell tart recipe for teatime that uses ready-made pastry and takes about 70 minutes total — is it difficult?
156,bd5f202b-a407-4588-8195-e11193100a49,Mini Bakewell tarts topped with icing and a glacé cherry — can I get nutrition info and suggested servings for this nostalgic treat?
156,bd5f202b-a407-4588-8195-e11193100a49,4-star easy bakewell tart recipe with 30 minutes prep — how many tarts does this make and any tips for using shop-bought pastry?
157,3ca4b55d-ae79-46ea-b4b4-d1b1bec833fd,How do I make a next-level egg custard tart with brown-butter pastry and a nutmeg-scented filling?
157,3ca4b55d-ae79-46ea-b4b4-d1b1bec833fd,Is there a custard tart recipe that uses 8 egg yolks and 600ml double cream for an extra-rich custard?
157,3ca4b55d-ae79-46ea-b4b4-d1b1bec833fd,"Can I bake a brown-butter pastry custard tart in about 80 minutes total, or does it need more resting/baking time?"
157,3ca4b55d-ae79-46ea-b4b4-d1b1bec833fd,"What tips help achieve a glossy, well-set custard in a highly rated (5-star) egg custard tart made with vanilla and double cream?"
157,3ca4b55d-ae79-46ea-b4b4-d1b1bec833fd,Is this 'more effort' next-level egg custard tart with brown butter pastry doable for a confident home baker?
158,98bafc48-0334-45e1-a316-5586596817fd,Millionaire's chocolate tart with a caramel layer and both 70% dark and white chocolate — how long does it take to make (about 85 minutes)?
158,98bafc48-0334-45e1-a316-5586596817fd,Dinner-party millionaire's shortbread-style tart using ready shortcrust pastry — is this recipe kid-friendly and not too bitter?
158,98bafc48-0334-45e1-a316-5586596817fd,Highly rated (5-star) millionaire's chocolate tart — what's the nutritional info (around 618 kcal) and is it suitable for guests?
158,98bafc48-0334-45e1-a316-5586596817fd,"More-effort sweet tart with caramel, eggs and melted butter — can I make this millionaire's chocolate tart ahead for a party?"
158,98bafc48-0334-45e1-a316-5586596817fd,"Where can I find a millionaire's chocolate tart recipe with vanilla extract, a shortcrust base and a dark + white chocolate topping, plus prep and cook times?"
159,4663f186-7068-4e00-a72c-cc713521b774,Is there an easy butternut squash tarte tatin recipe that uses ready-rolled puff pastry and takes about 90 minutes total?
159,4663f186-7068-4e00-a72c-cc713521b774,"How can I make a sweet vegetable tarte tatin with butternut, ground ginger and cinnamon, served warm with vanilla ice cream?"
159,4663f186-7068-4e00-a72c-cc713521b774,Looking for a vegetarian tarte tatin using around 650–700g butternut and golden caster sugar—any simple recipe?
159,4663f186-7068-4e00-a72c-cc713521b774,Any butternut squash tarte tatin that's about 249 kcal per serving and rated highly by home cooks?
159,4663f186-7068-4e00-a72c-cc713521b774,Beginner-friendly sweet tart: butternut squash tarte tatin using half a block of puff pastry and crème fraîche to serve?
160,7383f802-5177-4a41-8dbc-f41b658ac87a,"Chocolate, hazelnut & salted caramel tart with a buttery pastry case and fudge filling — where can I find the recipe?"
160,7383f802-5177-4a41-8dbc-f41b658ac87a,Recipe for a hazelnut and salted caramel tart studded with toasted hazelnuts and made using 70% dark chocolate?
160,7383f802-5177-4a41-8dbc-f41b658ac87a,How long does it take to make a chocolate hazelnut tart with a caramel layer — is the total time about 90 minutes?
160,7383f802-5177-4a41-8dbc-f41b658ac87a,More-effort dessert tart with sea salt flakes and golden syrup caramel plus a rich chocolate filling (around 424 kcal per serving) — recipe?
160,7383f802-5177-4a41-8dbc-f41b658ac87a,"Gourmet 5-star sweet tart: chocolate, hazelnut and salted caramel — what are the ingredients and difficulty level?"
161,96a17a02-0f23-40c9-925c-274fe847de35,Easy peach and almond tart with ground almonds and sliced fresh peaches — total time around 85 minutes?
161,96a17a02-0f23-40c9-925c-274fe847de35,5-star peach & almond tart with melt-in-the-mouth pastry — is this the recipe that’s served with crème fraîche and peach preserve?
161,96a17a02-0f23-40c9-925c-274fe847de35,Peach tart with almond frangipane that needs about 25 minutes prep and 60 minutes baking — simple enough for a home baker?
161,96a17a02-0f23-40c9-925c-274fe847de35,What are the nutrition facts for the peach & almond tart (about 537 kcal and 10 g protein per serving)?
161,96a17a02-0f23-40c9-925c-274fe847de35,Simple sweet tart using 140g ground almonds and an apricot jam glaze — good weekend dessert recipe?
162,794b377a-f32e-47b9-96b0-dc672fb9df09,Do you have a vegan chocolate and date tart recipe made with medjool dates and coconut milk?
162,794b377a-f32e-47b9-96b0-dc672fb9df09,Looking for a decadent vegan shortcrust tart using dairy-free dark chocolate and coconut oil — any recipes?
162,794b377a-f32e-47b9-96b0-dc672fb9df09,Vegan dessert ideas: a chocolate & date tart that takes about 70 minutes total and is good for guests?
162,794b377a-f32e-47b9-96b0-dc672fb9df09,Recipe for a more-effort chocolate and date tart that uses a ready shortcrust pastry sheet and 200g dark chocolate?
162,794b377a-f32e-47b9-96b0-dc672fb9df09,"Five-star vegan chocolate and date tart — rich, impressive tart for entertaining with dates and cocoa?"
163,3045b260-9ce2-4a2c-8b3f-293469205844,Classic custard tart with freshly grated nutmeg and a vanilla pod — is there a recipe that takes about 1h50 total?
163,3045b260-9ce2-4a2c-8b3f-293469205844,"Recipe for a rich custard tart made with double cream and whole milk, plus 4 eggs and golden caster sugar?"
163,3045b260-9ce2-4a2c-8b3f-293469205844,5-star custard tart using a 500g pack of shortcrust pastry — how long is the baking time (95 minutes) and is it difficult?
163,3045b260-9ce2-4a2c-8b3f-293469205844,Custard tart topped with grated nutmeg — roughly 405 kcal per serving — where can I find the ingredients and method?
163,3045b260-9ce2-4a2c-8b3f-293469205844,Can I make a nutmeg-topped custard tart ahead of time? It’s listed as ‘more effort’ and totals 110 minutes.
164,e16f0517-f99c-41ff-bbc5-9f7d768cca4b,Easy Blueberry & almond tart using a 23–24cm shortcrust pastry case — how long does it take and what ingredients are required?
164,e16f0517-f99c-41ff-bbc5-9f7d768cca4b,Summer blueberry and almond tart recipe that uses ground almonds and a few drops of almond extract (uses two 125g punnets of blueberries) — how do I make it?
164,e16f0517-f99c-41ff-bbc5-9f7d768cca4b,"Is there a simple, highly rated (5-star) blueberry & almond tart that's about 65 minutes total and suitable for beginner bakers?"
164,e16f0517-f99c-41ff-bbc5-9f7d768cca4b,How rich is the blueberry and almond tart — approximately 500 kcal per serving and made with caster sugar and ground almonds?
164,e16f0517-f99c-41ff-bbc5-9f7d768cca4b,Recipe for an easy blueberry & almond tart on a Mary Cadogan shortcrust base — any tips for baking a 23–24cm tart case and dusting with icing sugar?
165,ca022a29-88ea-4a3f-bcf7-528473907289,Easy banoffee pie with buttery pastry and 394g dulce de leche — can I make this in about 65 minutes?
165,ca022a29-88ea-4a3f-bcf7-528473907289,Family favourite banoffee tart with sliced bananas and a generous dollop of double cream — simple recipe for beginners?
165,ca022a29-88ea-4a3f-bcf7-528473907289,How do I make a highly rated (5-star) banoffee pie using caramel or dulce de leche and optional dark chocolate?
165,ca022a29-88ea-4a3f-bcf7-528473907289,"Banoffee pie for guests: recipe that uses 4 bananas and a chilled-butter pastry (easy level, ~1 hour total)?"
165,ca022a29-88ea-4a3f-bcf7-528473907289,Beginner-friendly sweet tart: banoffee pie that separates an egg and uses golden caster sugar — is this recipe straightforward?
166,e51b1126-c197-4778-959b-582f0226dba5,Easy caramelised passion fruit and lime tart recipe using shop-bought dessert pastry and double cream — total time about 70 minutes?
166,e51b1126-c197-4778-959b-582f0226dba5,How do I make a zingy passion fruit & lime sweet tart that uses 8 passion fruits and golden caster sugar?
166,e51b1126-c197-4778-959b-582f0226dba5,5-star caramelised passionfruit and lime tart — is there a recipe around 546 kcal per serving?
166,e51b1126-c197-4778-959b-582f0226dba5,Simple passionfruit and lime tart for beginners (easy) with egg yolks and a caramelised top — any recipe suggestions?
166,e51b1126-c197-4778-959b-582f0226dba5,"Quick-ish dessert tart: caramelised passion fruit & lime, takes ~30 min prep and 40 min cooking — where can I find that recipe?"
167,90b50151-7598-402a-9bb9-ecde34636beb,Easy chocolate crunch with caramel sauce — is there a family dessert recipe like school-dinner chocolate squares that takes about 45 minutes total?
167,90b50151-7598-402a-9bb9-ecde34636beb,"How do I make kid-friendly chocolate squares with ground almonds and a demerara sugar topping, served with caramel sauce?"
167,90b50151-7598-402a-9bb9-ecde34636beb,Looking for an easy chocolate crunch recipe that uses 4 tbsp caramel and 50ml single cream for the sauce — is there one rated around 4 stars?
167,90b50151-7598-402a-9bb9-ecde34636beb,"Quick family dessert: chocolate squares made with cocoa and golden caster sugar, served with a caramel sauce — simple enough for kids?"
167,90b50151-7598-402a-9bb9-ecde34636beb,"Simple, kid-approved chocolate crunch with ground almonds and cocoa — where can I find a straightforward, easy recipe?"
168,cd93d006-5ac5-46c5-8c9c-2ec1126a5a0f,Easy family salted caramel & apple pudding that takes about 50 minutes and uses a tin of caramel and double cream?
