,id,questions
468,e79e5046-78e5-45d8-905b-a1fe8f2adfaf,How do I make easy vegan chocolate ice cream using canned coconut milk and cornflour in about 45 minutes?
468,e79e5046-78e5-45d8-905b-a1fe8f2adfaf,"Dairy-free, egg-free chocolate ice cream recipe with vegan dark chocolate and two 400g cans of coconut milk?"
468,e79e5046-78e5-45d8-905b-a1fe8f2adfaf,Quick homemade vegan chocolate ice cream — simple 5-star rated recipe that's gluten free?
468,e79e5046-78e5-45d8-905b-a1fe8f2adfaf,Can I make a rich vegan chocolate ice cream with vanilla bean paste and cornflour (no dairy)?
468,e79e5046-78e5-45d8-905b-a1fe8f2adfaf,Best easy vegan chocolate ice cream recipe using coconut milk and caster sugar?
469,ec0d5e8d-36ab-4a4a-b3c2-9dccd8f42d19,Vegan chocolate and date tart recipe using medjool dates and dairy-free dark chocolate — ready in about 70 minutes?
469,ec0d5e8d-36ab-4a4a-b3c2-9dccd8f42d19,How do I make a decadent vegan chocolate & date tart in a shortcrust pastry case (uses coconut milk and coconut oil)?
469,ec0d5e8d-36ab-4a4a-b3c2-9dccd8f42d19,"Looking for a more-effort, impressive chocolate and date tart for guests — any recipe that uses pitted medjool dates and a vegan pastry sheet?"
469,ec0d5e8d-36ab-4a4a-b3c2-9dccd8f42d19,"5-star vegan chocolate & date tart — best recipe that combines chopped dates, cocoa and coconut milk for a rich filling?"
469,ec0d5e8d-36ab-4a4a-b3c2-9dccd8f42d19,Recipe for a vegan chocolate tart with dates that takes ~30 min prep and 40 min cooking using dairy-free dark chocolate?
470,d01540da-ca55-434e-a6ec-09fdaddd70ba,Easy vegan cherry & almond brownies recipe with glacé cherries — how do I make them?
470,d01540da-ca55-434e-a6ec-09fdaddd70ba,"Vegan chocolate brownie using ground almond and flaxseed as an egg replacer, total time around 65 minutes?"
470,d01540da-ca55-434e-a6ec-09fdaddd70ba,Dairy- and egg-free rich chocolate brownies with dark chocolate and a hint of coffee granules — recipe?
470,d01540da-ca55-434e-a6ec-09fdaddd70ba,"Quick bake: indulgent almond and cherry brownies (prep 20 mins, cook 45 mins) — ingredients and tips?"
470,d01540da-ca55-434e-a6ec-09fdaddd70ba,5-star vegan cherry & almond brownie recipe that's simple to make and deeply rich — where can I find it?
471,d08e1272-7a72-41eb-a9bf-5238c5270521,No-bake vegan dark chocolate squares with stem ginger and pistachios — is there a quick 20-minute recipe?
471,d08e1272-7a72-41eb-a9bf-5238c5270521,How do I make easy no-oven vegan chocolate squares using gingernut biscuits and dark chocolate?
471,d08e1272-7a72-41eb-a9bf-5238c5270521,Simple recipe for vegan chocolate pistachio squares studded with chopped stem ginger — what ingredients are needed?
471,d08e1272-7a72-41eb-a9bf-5238c5270521,Looking for a highly rated (5-star) no-cook chocolate bake with gingernuts and a quick ganache topping — any suggestions?
471,d08e1272-7a72-41eb-a9bf-5238c5270521,Afternoon tea treat: easy vegan dark chocolate and pistachio squares with gingernut crunch — recipe ideas?
472,58894ffa-2b30-43f5-b169-b32892872cf3,Vegan millionaire's shortbread recipe with medjool dates and cashews — gluten-free and about 35 minutes total?
472,58894ffa-2b30-43f5-b169-b32892872cf3,How do I make vegan millionaire's shortbread using maple syrup and coconut oil (no dairy)?
472,58894ffa-2b30-43f5-b169-b32892872cf3,Gluten-free chocolate bars with an oat and cashew base — is there a vegan millionaire's shortbread like this rated 4 stars?
472,58894ffa-2b30-43f5-b169-b32892872cf3,"Recipe for vegan chocolate bakes: millionaire's shortbread with rolled oats, cashews and a cocoa topping?"
472,58894ffa-2b30-43f5-b169-b32892872cf3,More effort vegan dessert: quick-prep millionaire's shortbread using 150g cashews and lots of dates?
473,396cefc9-c235-4808-9078-58b1e208816e,Easy vegan cookies & cream brownies with dairy-free coconut yogurt and a broken cookie topping — ready in about 45 minutes?
473,396cefc9-c235-4808-9078-58b1e208816e,"Looking for a simple vegan chocolate bake using storecupboard items like self-raising flour, soft brown sugar and cocoa powder?"
473,396cefc9-c235-4808-9078-58b1e208816e,Vegan cookies & cream brownie recipe that uses white wine vinegar instead of eggs — is there one that's child-friendly and easy?
473,396cefc9-c235-4808-9078-58b1e208816e,4-star rated cookies & cream brownies that use vegetable oil and vanilla — how do I make that vegan version with cookie chunks on top?
473,396cefc9-c235-4808-9078-58b1e208816e,"Quick, no-expensive-ingredients vegan brownie with coconut yogurt and crushed vegan cookies — any easy recipe like that?"
474,65136209-68c2-44fe-bcde-835a37019d13,Quick vegan chocolate banana ice cream using just frozen banana and cocoa powder — how do I make it?
474,65136209-68c2-44fe-bcde-835a37019d13,Easy 5-minute dairy-free and gluten-free chocolate 'nice cream' recipe?
474,65136209-68c2-44fe-bcde-835a37019d13,Is there a low-fat vegan chocolate ice cream around 110 kcal per serving that's simple to make?
474,65136209-68c2-44fe-bcde-835a37019d13,"Beginner-friendly, 4-star vegan chocolate banana ice cream — any easy recipe recommendations?"
474,65136209-68c2-44fe-bcde-835a37019d13,Two-ingredient vegan chocolate ice cream (frozen banana + cocoa) — best method for a creamy texture?
475,85bdf18a-de3b-4397-916e-94d1ac28af38,How do I make a 5-minute vegan chocolate chia pudding using almond or hazelnut milk and cacao powder?
475,85bdf18a-de3b-4397-916e-94d1ac28af38,Is this chocolate chia pudding really low-calorie (around 130 kcal) and made with 60g chia seeds per batch?
475,85bdf18a-de3b-4397-916e-94d1ac28af38,Can I prep an easy no-cook chocolate chia pudding sweetened with maple syrup and topped with cacao nibs and frozen berries ahead of time?
475,85bdf18a-de3b-4397-916e-94d1ac28af38,"What are the nutrition highlights for this chocolate chia pudding (fibre ~7g, protein ~4g and a good source of omega-3)?"
475,85bdf18a-de3b-4397-916e-94d1ac28af38,"How many servings does a recipe with 60g chia seeds and 400ml almond milk make, and is it suitable for a vegan diet?"
476,511eeef8-b2bb-42d6-ae95-b81631cdf859,Easy vegan chocolate sponge cake with dairy-free buttercream and seasonal fruit — recipe that takes about 55 minutes?
476,511eeef8-b2bb-42d6-ae95-b81631cdf859,How can I make a dairy-free chocolate cake using oat milk and cider vinegar?
476,511eeef8-b2bb-42d6-ae95-b81631cdf859,Beginner-friendly vegan chocolate cake recipe using self-raising flour and golden caster sugar?
476,511eeef8-b2bb-42d6-ae95-b81631cdf859,Vegan chocolate layer cake with dairy-free dark chocolate and 'buttercream' frosting — any simple recipe ideas?
476,511eeef8-b2bb-42d6-ae95-b81631cdf859,Special occasion vegan chocolate bake topped with cherries or figs that uses dairy-free spread for the frosting?
477,5f5ec16d-12d7-45fd-9fc1-807198309274,Vegan salted caramel biscuit bars recipe with medjool dates and maple syrup — how long does it take to make (about 60 minutes)?
477,5f5ec16d-12d7-45fd-9fc1-807198309274,"How can I make dairy-free, refined-sugar-free salted caramel biscuit bars using oats, ground almonds and peanut butter?"
477,5f5ec16d-12d7-45fd-9fc1-807198309274,Are these salted caramel biscuit bars hard to make for a home baker? (Recipe listed as 'more effort' and uses dairy-free dark chocolate)
477,5f5ec16d-12d7-45fd-9fc1-807198309274,"Tips for getting the right texture in vegan caramel biscuit bars made with coconut oil, almond/peanut butter and 150g dairy-free dark chocolate?"
477,5f5ec16d-12d7-45fd-9fc1-807198309274,Healthy snack idea: salted caramel biscuit bars with porridge oats and dates — is this a good refined-sugar-free bake for entertaining (total time ~60 mins)?
478,70e8dba0-424e-48e9-93db-9d1c0ed66821,"Is there a dairy-, gluten-, nut- and egg-free chocolate and raspberry pots recipe I can make for guests?"
478,70e8dba0-424e-48e9-93db-9d1c0ed66821,"Quick 15-minute vegan chocolate pots with raspberries, Cointreau and orange zest — where's the recipe?"
478,70e8dba0-424e-48e9-93db-9d1c0ed66821,How do I make allergy-friendly chocolate crunch pots using gluten-free muesli for a nut-free dessert?
478,70e8dba0-424e-48e9-93db-9d1c0ed66821,Looking for a 5-star vegan chocolate raspberry pot recipe around 300 kcal per serving — any suggestions?
478,70e8dba0-424e-48e9-93db-9d1c0ed66821,Challenging vegan chocolate bake using Free From dark chocolate and soya milk — step-by-step recipe?
479,d3c0631b-d743-4bf7-861d-051c3c56bd97,Easy vegan Victoria sponge recipe using oat milk and dairy-free spread?
479,d3c0631b-d743-4bf7-861d-051c3c56bd97,How long does it take to make a vegan sponge cake with vanilla pod and strawberry jam (about 55 minutes)?
479,d3c0631b-d743-4bf7-861d-051c3c56bd97,Simple vegan sponge cake for afternoon tea that uses self-raising flour and bicarbonate of soda?
479,d3c0631b-d743-4bf7-861d-051c3c56bd97,Vegan cake recipe for a coffee morning that uses cider vinegar and dairy-free milk — is there an easy Victoria sponge?
479,d3c0631b-d743-4bf7-861d-051c3c56bd97,Looking for a well-rated (4-star) easy vegan sponge with icing sugar dusting and jam filling — any recipes?
480,808f4c21-a0fa-4bdc-bc81-2448ad9d8430,Easy vegan chocolate party traybake recipe — can I make it in about 75 minutes using plant milk?
480,808f4c21-a0fa-4bdc-bc81-2448ad9d8430,Vegan traybake that uses light muscovado sugar and dairy-free dark chocolate for a chocolatey party cake?
480,808f4c21-a0fa-4bdc-bc81-2448ad9d8430,How to make a moist vegan chocolate sponge with soy yogurt and apple cider vinegar for a party-sized traybake?
480,808f4c21-a0fa-4bdc-bc81-2448ad9d8430,"Simple chocolate vegan traybake frosting idea using vegan spread and icing sugar, decorated with vegan sprinkles?"
480,808f4c21-a0fa-4bdc-bc81-2448ad9d8430,"5-star rated vegan chocolate traybake that uses sunflower oil and a choice of soy, almond or coconut milk?"
481,e387d6d8-733d-425a-bb2f-ccfea49fcaed,"Is there an easy, fudgy vegan gluten-free chocolate cake made with avocado and topped with a rich dairy-free frosting?"
481,e387d6d8-733d-425a-bb2f-ccfea49fcaed,"Quick vegan chocolate cake recipe (around 55 minutes) that's free from dairy, eggs, wheat and nuts?"
481,e387d6d8-733d-425a-bb2f-ccfea49fcaed,How can I make a moist vegan chocolate cake using mashed avocado and 70% dairy-free chocolate chunks?
481,e387d6d8-733d-425a-bb2f-ccfea49fcaed,Simple beginner-friendly chocolate cake that uses soya milk and dairy-free sunflower spread — any recipes?
481,e387d6d8-733d-425a-bb2f-ccfea49fcaed,Any 4-star gluten-free vegan chocolate cake recipes with a rich frosting and vegan sprinkles for decorating?
482,c0879d02-37e4-4e70-880d-12cea56c61e1,Easy vegan banana and peanut butter cupcakes that use egg-free mayonnaise — is the total time really about 45 minutes?
482,c0879d02-37e4-4e70-880d-12cea56c61e1,"How do I make a 5-star vegan cupcake with mashed banana, smooth peanut butter and vegan dark chocolate chips?"
482,c0879d02-37e4-4e70-880d-12cea56c61e1,Can I frost these vegan cupcakes using almond milk and vegan margarine for a dairy-free peanut butter icing?
482,c0879d02-37e4-4e70-880d-12cea56c61e1,Beginner-friendly vegan cupcake recipe using egg-free mayonnaise and ripe bananas — is this simple to make?
482,c0879d02-37e4-4e70-880d-12cea56c61e1,Are there vegan banana & peanut butter cupcakes that use smooth peanut butter and are ready in under an hour?
483,5710bf91-c09d-4ba4-85ef-a7b88d10ea12,Easy vegan carrot cake with coconut and cashew icing — is there a recipe I can make in about 65 minutes?
483,5710bf91-c09d-4ba4-85ef-a7b88d10ea12,Vegan carrot sandwich cake that uses creamed coconut sachets and cashew nut butter — where can I find this recipe?
483,5710bf91-c09d-4ba4-85ef-a7b88d10ea12,Can I swap almond milk for the oat milk in an easy vegan carrot cake made with coconut oil and walnuts?
483,5710bf91-c09d-4ba4-85ef-a7b88d10ea12,Looking for a 4‑star vegan carrot cake with orange zest and grated carrots topped with coconut‑cashew icing—any simple recipes?
483,5710bf91-c09d-4ba4-85ef-a7b88d10ea12,How can I decorate an easy vegan carrot cake with cashew icing and edible flowers for a celebration?
484,8e12643a-26f8-4093-99b5-c24969e7f64f,Easy vegan chocolate cake recipe made with oat milk and dairy-free spread — ready in about 55 minutes?
484,8e12643a-26f8-4093-99b5-c24969e7f64f,Vegan chocolate sponge for a special occasion topped with dairy-free buttercream and seasonal fruits like cherries or figs?
484,8e12643a-26f8-4093-99b5-c24969e7f64f,How do I make a dairy-free chocolate cake using cider vinegar and bicarbonate of soda for a light sponge?
484,8e12643a-26f8-4093-99b5-c24969e7f64f,Recipe for a vegan chocolate cake frosting using dairy-free spread and icing sugar (no butter)?
484,8e12643a-26f8-4093-99b5-c24969e7f64f,4-star vegan chocolate cake that's quick to bake (20 minutes in the oven) — is this recipe beginner-friendly?
485,3793e23d-c794-4090-8814-730e70de90d3,Easy vegan Victoria sponge recipe using oat milk and a vanilla pod — about 55 minutes to make?
485,3793e23d-c794-4090-8814-730e70de90d3,Vegan sponge cake made with dairy-free spread and cider vinegar — is this good for afternoon tea or a coffee morning?
485,3793e23d-c794-4090-8814-730e70de90d3,How do I make a simple vegan Victoria sponge filled with strawberry jam and dairy-free icing sugar?
485,3793e23d-c794-4090-8814-730e70de90d3,Beginner-friendly vegan sponge using self-raising flour and bicarbonate of soda — is this an easy recipe to try?
485,3793e23d-c794-4090-8814-730e70de90d3,Is this 4-star vegan sponge (total time ~55 mins) suitable for serving friends at a small tea party?
486,aa95d0e9-e63a-498c-8856-b44aa9217a19,Is there an easy fudgy vegan chocolate cake that's gluten-free and made with avocado and dairy-free chocolate?
486,aa95d0e9-e63a-498c-8856-b44aa9217a19,Vegan chocolate cake using mashed avocado and soya milk — any recipe that takes around 55 minutes total?
486,aa95d0e9-e63a-498c-8856-b44aa9217a19,"Nut-free, egg-free gluten-free chocolate cake recipe that uses dairy-free sunflower spread and muscovado sugar?"
486,aa95d0e9-e63a-498c-8856-b44aa9217a19,Beginner-friendly vegan chocolate cake with a rich dairy-free chocolate frosting and vegan sprinkles — can I make this for a celebration?
486,aa95d0e9-e63a-498c-8856-b44aa9217a19,4-star easy vegan chocolate cake made with 70% dairy-free chocolate and avocado — is this suitable for first-time bakers?
487,068463c7-3709-4b3d-ba80-7e1f25b4040b,Easy vegan cookies and cream cake using oat milk and coconut yogurt — can I make this in about 65 minutes total?
487,068463c7-3709-4b3d-ba80-7e1f25b4040b,Dairy-free cookies and cream birthday cake recipe that uses crème-filled chocolate sandwich cookies for kids?
487,068463c7-3709-4b3d-ba80-7e1f25b4040b,Simple 5-star vegan chocolate cake with a vegan spread and icing sugar frosting — recipe using cocoa and 150g cookies?
487,068463c7-3709-4b3d-ba80-7e1f25b4040b,Vegan cookies & cream cake that's labeled easy — what are the steps if I have 30 minutes prep and a 35-minute bake time?
487,068463c7-3709-4b3d-ba80-7e1f25b4040b,Allergen-friendly dairy-free cookies and cream cake using sunflower oil and light brown sugar — any tips or ingredient swaps?
488,91214ce1-35f8-4a3f-88aa-1b80e75d885b,"Easy no-bake vegan lemon cheesecake recipe with cashews and dates — dairy-free and gluten-free, about 15 minutes prep?"
488,91214ce1-35f8-4a3f-88aa-1b80e75d885b,"Quick vegan lemon cheesecake using cashew 'cream', agave syrup and almond milk (no cooking) — any simple recipe?"
488,91214ce1-35f8-4a3f-88aa-1b80e75d885b,"Gluten-free lemon cheesecake with a blanched almond crust and coconut oil — is there an easy, 4-star no-cook version?"
488,91214ce1-35f8-4a3f-88aa-1b80e75d885b,Can I make a lemon vegan cheesecake with 300g cashews and 2 lemons in under 20 minutes?
488,91214ce1-35f8-4a3f-88aa-1b80e75d885b,"Simple ingredient list for a vegan lemon cheesecake that uses dates, cashews and a bit of agave syrup?"
489,361a9392-15e7-45f5-b1b4-3815d1f3698f,Easy vegan apple and almond cake using oat milk and dairy-free spread — how do I make this?
489,361a9392-15e7-45f5-b1b4-3815d1f3698f,Vegan apple cake with chopped Granny Smith apples and flaked almonds — is the total time really about 100 minutes?
489,361a9392-15e7-45f5-b1b4-3815d1f3698f,Simple egg-free cake flavored with almond extract and two sugars (caster + light brown) — what ingredients and bake time do I need?
489,361a9392-15e7-45f5-b1b4-3815d1f3698f,Looking for an easy vegan cake to fill a cake tin for afternoon tea — a recipe with oat milk and chopped apples?
489,361a9392-15e7-45f5-b1b4-3815d1f3698f,4-star vegan apple cake — prep/cooking times and any tips for keeping the apple pieces from sinking?
490,ed2c26a6-eb7d-4fe9-8d99-af6609343c64,Vegan simnel cake recipe with marzipan and a blowtorched burnished top — how do I make it?
490,ed2c26a6-eb7d-4fe9-8d99-af6609343c64,3-hour vegan simnel cake with mixed dried fruit and glacé cherries — is there a recipe for Easter?
490,ed2c26a6-eb7d-4fe9-8d99-af6609343c64,More effort but easy vegan cake using soya milk and dairy-free spread — vegan simnel cake ideas?
490,ed2c26a6-eb7d-4fe9-8d99-af6609343c64,Top-rated (5-star) vegan simnel cake using ground almonds and vanilla bean paste — any tips or tweaks?
490,ed2c26a6-eb7d-4fe9-8d99-af6609343c64,How to make a vegan simnel cake with marzipan balls and citrus zest (lemon & orange) for Easter?
491,4b355238-ebdf-4b4d-b68e-51cfcafa9685,Vegan ginger loaf cake with treacle and stem ginger — is there a recipe I can make in about 65 minutes?
491,4b355238-ebdf-4b4d-b68e-51cfcafa9685,Easy iced and spiced vegan loaf using dark muscovado and ground ginger — any simple recipes?
491,4b355238-ebdf-4b4d-b68e-51cfcafa9685,How do I make a 5-star vegan ginger loaf topped with lemon icing and crystallised stem ginger?
491,4b355238-ebdf-4b4d-b68e-51cfcafa9685,Beginner-friendly vegan ginger loaf for autumn that uses 100ml vegetable oil and 50g treacle?
491,4b355238-ebdf-4b4d-b68e-51cfcafa9685,Quick vegan ginger loaf recipe with 15 minutes prep and 50 minutes baking time?
492,4084a1a3-3f96-4147-af24-152025247ba7,Easy vegan carrot cake with coconut and cashew icing — is there a recipe that takes about 65 minutes total?
492,4084a1a3-3f96-4147-af24-152025247ba7,Vegan sandwich carrot cake using creamed coconut sachets and oat milk — any simple free-from recipe?
492,4084a1a3-3f96-4147-af24-152025247ba7,"Dairy-free carrot cake with orange zest and chopped walnuts, decorated with edible flowers — how can I make an easy version?"
492,4084a1a3-3f96-4147-af24-152025247ba7,Beginner-friendly vegan carrot cake that uses coconut oil and cashew nut butter frosting — suitable for an easy bake?
492,4084a1a3-3f96-4147-af24-152025247ba7,"4-star vegan carrot cake recipe spiced with cinnamon, nutmeg and ginger and about 30 minutes baking time?"
493,1af484d7-2b4a-49a5-b1c1-28d9c100dff5,How can I make squidgy vegan brownies using ground flaxseed and 200g dark chocolate in about 55 minutes?
493,1af484d7-2b4a-49a5-b1c1-28d9c100dff5,Easy dairy-free brownie recipe with ground almonds and cocoa powder — suitable for beginners?
493,1af484d7-2b4a-49a5-b1c1-28d9c100dff5,Vegan brownie recipe rated 5 stars that uses a little coffee granules and vanilla for extra depth of flavor?
493,1af484d7-2b4a-49a5-b1c1-28d9c100dff5,What's a simple egg-free brownie using 2 tbsp ground flaxseed and 80g vegan margarine?
493,1af484d7-2b4a-49a5-b1c1-28d9c100dff5,"Quick vegan brownies with golden caster sugar and self-raising flour — prep 15 mins, bake ~40 mins?"
494,13f475cf-bcb8-4a40-8c81-14a356a19bd5,Easy vegan lemon cake that's light and zingy — can I bake it in about 45 minutes?
494,13f475cf-bcb8-4a40-8c81-14a356a19bd5,Vegan lemon cake using vegetable oil and self-raising flour — will it work if I swap in gluten-free flour and baking powder?
494,13f475cf-bcb8-4a40-8c81-14a356a19bd5,Beginner-friendly vegan lemon cake with 15 minutes prep — does it include a lemon icing made from icing sugar and lemon juice?
494,13f475cf-bcb8-4a40-8c81-14a356a19bd5,"Looking for a simple vegan lemon drizzle cake with lemon zest and golden caster sugar — this one has a 4-star rating, is it worth trying?"
494,13f475cf-bcb8-4a40-8c81-14a356a19bd5,Quick vegan lemon cake recipe using golden caster sugar and vegetable oil — total cooking time around 30 minutes (45 min overall)?
495,166aca32-ed22-4d9e-9c53-080391235114,Easy vegan chocolate cake recipe with oat milk and dairy-free buttercream — ready in about 55 minutes?
495,166aca32-ed22-4d9e-9c53-080391235114,How do I make a simple vegan chocolate sponge using dairy-free spread and a splash of cider vinegar?
495,166aca32-ed22-4d9e-9c53-080391235114,Vegan chocolate cake topped with seasonal fruits like cherries or figs — any recipe that uses dairy-free dark chocolate?
495,166aca32-ed22-4d9e-9c53-080391235114,"Beginner-friendly vegan celebration cake (easy, 55 min total) — is there a highly rated 4/5 version with chocolate buttercream?"
495,166aca32-ed22-4d9e-9c53-080391235114,Chocolate sponge recipe using self-raising flour and bicarbonate of soda for a dairy-free cake?
496,2bd685ab-c840-4f62-a160-1561b940ecfe,Is there a microwave vegan mug cake I can make in under 10 minutes that uses oat milk and raspberries?
496,2bd685ab-c840-4f62-a160-1561b940ecfe,Easy single-serve vegan mug cake with lemon zest that I can top with dairy-free ice cream — how long does it take and is it microwave-safe?
496,2bd685ab-c840-4f62-a160-1561b940ecfe,Simple vegan mug cake recipe for one using self-raising flour and sunflower oil (quick and easy)?
496,2bd685ab-c840-4f62-a160-1561b940ecfe,Looking for a quick 7-minute vegan mug cake (rated 4) with a lemony flavor and fresh or frozen raspberries — any recipes?
496,2bd685ab-c840-4f62-a160-1561b940ecfe,"Microwave mug cake that uses 3 tbsp dairy-free milk (oat), pairs with coconut cream, and is ready in about 5–7 minutes?"
497,3dd265a4-ac75-4081-906a-3097be87ae90,Easy vegan banana and peanut butter cupcakes using egg-free mayonnaise and almond milk — ready in about 45 minutes?
497,3dd265a4-ac75-4081-906a-3097be87ae90,"Recipe for vegan cupcakes with mashed banana, peanut butter and vegan dark chocolate chips — no eggs or dairy?"
497,3dd265a4-ac75-4081-906a-3097be87ae90,How do I make a 5-star vegan cupcake that uses mayonnaise as an egg substitute and vegan margarine?
497,3dd265a4-ac75-4081-906a-3097be87ae90,Beginner-friendly vegan cupcakes with banana and peanut butter frosting made with icing sugar and vegan milk — any simple recipe?
497,3dd265a4-ac75-4081-906a-3097be87ae90,Looking for an easy vegan cupcake recipe with mashed bananas and 2 tbsp peanut butter — about 25 minutes prep time?
498,48be89db-0c9b-484c-ac9f-c9fd2bf8e7d5,Vegan cherry & almond brownies with glacé cherries and ground flaxseed — easy 65-minute recipe?
498,48be89db-0c9b-484c-ac9f-c9fd2bf8e7d5,"How do I make rich, dairy-free chocolate brownies using ground almond and dark chocolate (vegan)?"
498,48be89db-0c9b-484c-ac9f-c9fd2bf8e7d5,"Easy vegan brownie that uses coffee granules and flaxseed instead of eggs — 20 min prep, is this the one?"
498,48be89db-0c9b-484c-ac9f-c9fd2bf8e7d5,"Looking for a decadent, 5-star vegan cherry and almond brownie recipe (egg- and dairy-free) — any recommendations?"
498,48be89db-0c9b-484c-ac9f-c9fd2bf8e7d5,Can I bake vegan cherry & almond brownies using self-raising flour and glacé cherries — about 45 minutes in the oven?
499,1c699fe1-909e-4377-9068-a6ad52051165,Easy unicorn biscuits recipe with swirly vanilla dough and pink food colouring — ready in about 45 minutes?
499,1c699fe1-909e-4377-9068-a6ad52051165,Kids' party swirly vanilla cookies edged with sprinkles and white chocolate stars — how do I make these?
499,1c699fe1-909e-4377-9068-a6ad52051165,Unicorn biscuit idea using icing sugar and lemon juice for a glaze plus hundreds and thousands — is this suitable for baking with children?
499,1c699fe1-909e-4377-9068-a6ad52051165,Simple 4-star kids' biscuit recipe featuring pink-coloured dough and colourful sprinkles — quick prep (15 min) and 30 min bake?
499,1c699fe1-909e-4377-9068-a6ad52051165,"Party-friendly unicorn biscuits using basic ingredients (flour, butter, caster sugar, egg, vanilla) — easy recipe for beginners?"
500,20f11058-5c11-45ae-bd09-098e79ea0272,Easy birthday ring biscuits with lemon curd and strawberry conserve — can I make these in about 40 minutes?
500,20f11058-5c11-45ae-bd09-098e79ea0272,Kid-friendly party biscuits (ring shapes) using golden caster sugar and unsalted butter — are these good for getting kids to help?
500,20f11058-5c11-45ae-bd09-098e79ea0272,5-star rated simple birthday biscuits topped with white icing sugar — is this recipe suitable for a kids' party?
500,20f11058-5c11-45ae-bd09-098e79ea0272,Quick biscuit recipe with 30 minutes prep and 10 minutes baking — how many servings does this make for a party?
500,20f11058-5c11-45ae-bd09-098e79ea0272,What are the nutrition details for these birthday biscuits — they list about 149 kcal and 6g fat per serving?
501,ee4201ad-6044-4f87-a5b0-aecc6258796a,Easy chocolate orange cookies with candied orange peel — is there a quick 30-minute recipe that's good for Christmas gifts?
501,ee4201ad-6044-4f87-a5b0-aecc6258796a,Kid-friendly chocolate orange biscuits topped with sugared candied orange peel — any simple recipe that uses dark or milk chocolate?
501,ee4201ad-6044-4f87-a5b0-aecc6258796a,How can I make rich chocolate cookies flavored with orange zest and chopped candied peel in about 15 minutes prep and 15 minutes baking?
501,ee4201ad-6044-4f87-a5b0-aecc6258796a,Looking for an easy chocolate orange cookie recipe using self-raising flour and cocoa powder — is there one suitable for gifting?
